{
  "branch": "chore/repo-cleanup-tier1",
  "summary": "Records Tier 1 cleanup revalidation against current `main`: the audit's delete-now targets are already absent, the broken `start:stateful` script is already gone, and `vitest.config.ts` carries no stale include path. The tracker and cleanup spec are updated so later cleanup branches do not repeat that work.",
  "claims": [
    {
      "id": "c1",
      "statement": "The cleanup series revalidates stale configuration drift and leaves no broken `start:stateful` script or stale Vitest include paths.",
      "evidence_type": "deterministic_check",
      "evidence_path": "package.json; vitest.config.ts",
      "evidence_description": "Current `package.json` contains no `start:stateful` script, and current `vitest.config.ts` carries no stale include path.",
      "spec_claim_id": "SPEC-REPO-CLEANUP:c2"
    },
    {
      "id": "c2",
      "statement": "Repo docs and cleanup governance artifacts explicitly record accepted cleanup decisions, validation evidence, and deferred items so later sessions can continue without re-auditing the same scope.",
      "evidence_type": "implementation",
      "evidence_path": "cleanup/2026-06-03-repo-cleanup-tracker.md",
      "evidence_description": "The tracker now records that Tier 1 delete targets are already absent on current `main` and that the stale configuration items were already resolved before this branch.",
      "spec_claim_id": "SPEC-REPO-CLEANUP:c4"
    }
  ],
  "specs": [
    "SPEC-REPO-CLEANUP"
  ]
}