{
  "branch": "fix/cleanup-spec-frontmatter-yaml",
  "summary": "Quotes the `required_evidence` strings in the repo-cleanup spec frontmatter so the PR validator can parse `SPEC-REPO-CLEANUP` claims with YAML tooling.",
  "claims": [
    {
      "id": "c1",
      "statement": "Repo docs and cleanup governance artifacts explicitly record accepted cleanup decisions, validation evidence, and deferred items so later sessions can continue without re-auditing the same scope.",
      "evidence_type": "deterministic_check",
      "evidence_path": ".specs/repo-cleanup/SPEC-REPO-CLEANUP-2026-06.md",
      "evidence_description": "The cleanup spec frontmatter parses as YAML after quoting evidence strings that contain backticks and punctuation.",
      "spec_claim_id": "SPEC-REPO-CLEANUP:c4"
    }
  ],
  "specs": [
    "SPEC-REPO-CLEANUP"
  ]
}
