{
  "branch": "test/spec-fixture-missing-claim",
  "specs": ["SPEC-FIXTURE"],
  "summary": "Fixture PR — references a spec claim that does not exist (should fail validation).",
  "claims": [
    {
      "id": "c1",
      "spec_claim_id": "SPEC-FIXTURE:c99",
      "statement": "This claim id does not exist in SPEC-FIXTURE frontmatter",
      "evidence_type": "implementation",
      "evidence_path": null,
      "evidence_description": "Intentionally invalid for validator tests."
    }
  ]
}
