{
  "branch": "test/spec-fixture-valid",
  "specs": ["SPEC-FIXTURE"],
  "summary": "Fixture PR for validate:pr — references a valid spec claim with sufficient evidence.",
  "claims": [
    {
      "id": "c1",
      "spec_claim_id": "SPEC-FIXTURE:c1",
      "statement": "validate:pr resolves spec_claim_id references against spec frontmatter claims",
      "evidence_type": "deterministic_check",
      "evidence_path": "scripts/__tests__/validate-pr-description.test.ts",
      "evidence_description": "Vitest exercises validatePrDescription against this fixture branch."
    }
  ]
}
