{
  "branch": "chore/repo-cleanup-tracker",
  "summary": "Adds the durable repo-cleanup bootstrap artifacts: a claim-bearing cleanup spec, an approved execution plan, and a shadow tracker that records accepted decisions, audit corrections, branch breakdown, and validation expectations for the cleanup series.",
  "claims": [
    {
      "id": "c1",
      "statement": "The cleanup series removes only revalidated dead or unsupported repo artifacts while preserving currently authoritative assets such as `.agents/` and `FileSystemStorage`.",
      "evidence_type": "implementation",
      "evidence_path": ".specs/repo-cleanup/SPEC-REPO-CLEANUP-2026-06.md",
      "evidence_description": "The spec's scope locks and claim c1 explicitly preserve `.agents/` and `FileSystemStorage` while requiring revalidation before deletion.",
      "spec_claim_id": "SPEC-REPO-CLEANUP:c1"
    },
    {
      "id": "c2",
      "statement": "Repo docs and cleanup governance artifacts explicitly record accepted cleanup decisions, validation evidence, and deferred items so later sessions can continue without re-auditing the same scope.",
      "evidence_type": "implementation",
      "evidence_path": "cleanup/2026-06-03-repo-cleanup-tracker.md",
      "evidence_description": "The tracker and plan capture accepted decisions, known audit corrections, branch execution units, deferred items, and a validation log for the series.",
      "spec_claim_id": "SPEC-REPO-CLEANUP:c4"
    }
  ],
  "specs": [
    "SPEC-REPO-CLEANUP"
  ]
}