{
  "branch": "docs/repo-cleanup-authority-alignment",
  "summary": "Aligns repo authority docs with current source: the README now describes local and deployed runtime modes accurately, the unreleased changelog drops stale loop-embedding claims while preserving still-wired spec prompt entries, and the two stale `.specs` index files are rewritten around current frontmatter-and-PR-claim workflow rules.",
  "claims": [
    {
      "id": "c1",
      "statement": "The cleanup series aligns repo authority docs with current source by removing stale loop-embedding claims from the README, changelog, and `.specs` index docs while preserving currently wired spec-workflow prompt documentation.",
      "evidence_type": "deterministic_check",
      "evidence_path": "README.md; CHANGELOG.md; .specs/README.md; .specs/IMPLEMENTATION-READY.md; src/server-factory.ts",
      "evidence_description": "The docs now stop claiming loop embedding assets that are absent from the repo, and a deterministic source check confirms the spec-workflow prompts remain registered in `src/server-factory.ts`.",
      "spec_claim_id": "SPEC-REPO-CLEANUP:c5"
    },
    {
      "id": "c2",
      "statement": "Repo docs and cleanup governance artifacts explicitly record accepted cleanup decisions, validation evidence, and deferred items so later sessions can continue without re-auditing the same scope.",
      "evidence_type": "implementation",
      "evidence_path": "cleanup/2026-06-03-repo-cleanup-tracker.md",
      "evidence_description": "The tracker records the docs-alignment result, the exact validation outcome distinguishing removed loop assets from live spec prompts, and the deferment of ADR governance cleanup to a later bounded unit.",
      "spec_claim_id": "SPEC-REPO-CLEANUP:c4"
    }
  ],
  "specs": [
    "SPEC-REPO-CLEANUP"
  ]
}