{
  "branch": "chore/remove-unsupported-agent-runtime-artifacts",
  "summary": "Records that the unsupported `.gemini/`, `.pi/`, and root-level local Prometheus/Grafana/OTel stack artifacts targeted by the cleanup plan are already absent in the stacked checkout, while explicitly preserving current product observability code, docs, specs, and migrations.",
  "claims": [
    {
      "id": "c1",
      "statement": "The cleanup series removes only revalidated dead or unsupported repo artifacts while preserving currently authoritative assets such as `.agents/`, `FileSystemStorage`, and live product observability surfaces.",
      "evidence_type": "deterministic_check",
      "evidence_path": "cleanup/2026-06-03-repo-cleanup-tracker.md",
      "evidence_description": "Validation found the unsupported runtime artifact paths already absent and records that current `src/observability`, `src/otel`, web observability docs/specs, and Supabase OTel migrations are preserved as live product surfaces.",
      "spec_claim_id": "SPEC-REPO-CLEANUP:c1"
    },
    {
      "id": "c2",
      "statement": "Repo docs and cleanup governance artifacts explicitly record accepted cleanup decisions, validation evidence, and deferred items so later sessions can continue without re-auditing the same scope.",
      "evidence_type": "implementation",
      "evidence_path": "cleanup/2026-06-03-repo-cleanup-tracker.md",
      "evidence_description": "The tracker records the unsupported-runtime validation outcome and the boundary between absent local stack artifacts and preserved product observability surfaces.",
      "spec_claim_id": "SPEC-REPO-CLEANUP:c4"
    }
  ],
  "specs": [
    "SPEC-REPO-CLEANUP"
  ]
}
