{
  "branch": "docs/update-removed-assumptions-workflow-reference",
  "summary": "Updates the aspirational systems audit so the assumption registry verification entry no longer links to the removed `verify-assumptions.yml` workflow as current wiring. The entry now records that the hard-disabled workflow was removed during cleanup and leaves any replacement verification workflow as a future dedicated unit.",
  "claims": [
    {
      "id": "c1",
      "statement": "Repo docs and cleanup governance artifacts explicitly record accepted cleanup decisions, validation evidence, and deferred items so later sessions can continue without re-auditing the same scope.",
      "evidence_type": "implementation",
      "evidence_path": "docs/aspirational-systems-audit.md",
      "evidence_description": "The audit entry for assumption registry verification now reflects that the disabled workflow was removed rather than treating the deleted workflow path as current wiring.",
      "spec_claim_id": "SPEC-REPO-CLEANUP:c4"
    }
  ],
  "specs": [
    "SPEC-REPO-CLEANUP"
  ]
}
