{
  "branch": "chore/normalize-research-workflow-db",
  "summary": "Makes the research workflow system reproducible from tracked text sources by adding canonical `research-workflows/schema.sql`, `seed.sql`, and `README.md`, updating the research-workflow system map/tracker to point at those files, and removing the mutable SQLite database from git tracking while leaving it ignored locally.",
  "claims": [
    {
      "id": "c1",
      "statement": "Research workflow assets become reproducible from tracked text sources under `research-workflows/`, and the repository no longer relies on a tracked mutable SQLite binary as the authoritative seed artifact.",
      "evidence_type": "deterministic_check",
      "evidence_path": "research-workflows/schema.sql; research-workflows/seed.sql; research-workflows/README.md; research-workflows/workflows.db",
      "evidence_description": "A temporary SQLite database rebuilt from the new schema and seed files reproduces the expected seed counts, and `research-workflows/workflows.db` is removed from git tracking while remaining gitignored locally.",
      "spec_claim_id": "SPEC-REPO-CLEANUP:c3"
    },
    {
      "id": "c2",
      "statement": "Repo docs and cleanup governance artifacts explicitly record accepted cleanup decisions, validation evidence, and deferred items so later sessions can continue without re-auditing the same scope.",
      "evidence_type": "implementation",
      "evidence_path": "cleanup/2026-06-03-repo-cleanup-tracker.md",
      "evidence_description": "The tracker now records the canonical research-workflow schema/seed status and the regeneration validation outcome for this branch.",
      "spec_claim_id": "SPEC-REPO-CLEANUP:c4"
    }
  ],
  "specs": [
    "SPEC-REPO-CLEANUP"
  ]
}
