{
  "branch": "test/spec-fixture-missing-spec-list",
  "specs": [],
  "summary": "Fixture PR — references a valid spec claim but omits that spec from the top-level specs array (should fail validation).",
  "claims": [
    {
      "id": "c1",
      "spec_claim_id": "SPEC-FIXTURE:c1",
      "statement": "Spec claim references must be backed by the top-level specs list",
      "evidence_type": "deterministic_check",
      "evidence_path": "scripts/__tests__/validate-pr-description.test.ts",
      "evidence_description": "Intentionally invalid for validator tests."
    }
  ]
}
