{
  "branch": "test/spec-fixture-unknown-spec",
  "specs": ["SPEC-DOES-NOT-EXIST"],
  "summary": "Fixture PR — lists a non-existent spec alongside a __none__ cleanup claim (should fail validation).",
  "claims": [
    {
      "id": "c1",
      "spec_claim_id": "__none__",
      "statement": "Cleanup-only claim not tied to any spec",
      "evidence_type": "deterministic_check",
      "evidence_path": "scripts/__tests__/validate-pr-description.test.ts",
      "evidence_description": "Intentionally invalid for validator tests."
    }
  ]
}
